Observations,Score,Comments
,,
Software Working through Doc,,
"Does the website and documentation provide a clear, high-level overview of your software?",Y,
Does the website and documentation clearly describe the type of user who should use your software?,Y,
Do this project publish case studies to show how your software has been used by yourself and others?,Y,
,,
Project and Software's Uniquness,,
Is the name of the project/software unique?,Y,
Is the project/software name free from trademark violations?,Y,
,,
Avaibility of Software,,
Is this software available as a package that can be deployed without building it?,N,"In the readme file, link to the website has been given but it is currently down"
Is your software available for free?,Y,
"Is your source code publicly available to download, either as a downloadable bundle or via access to a source code repository?",Y,
"Is your software hosted in an established, third-party repository likeGitHub (https://github.com), BitBucket (https://bitbucket.org),LaunchPad (https://launchpad.net) orSourceForge (https://sourceforge.net)?",Y,
,,
Software's documentation,,
Is the documentation clearly available on your website or within your software?,Y,
"Does the documentation include a ""quick start"" guide, that provides a short overview of how to use your software with some basic examples of use?",Y,
"If the documentation is extensive, does this provide clear, step-by-step instructions on how to deploy and use the software?",Y,
"Does it provide a comprehensive guide to all the software’s commands, functions and options?",Y,
Does it provide troubleshooting information that describes the symptoms and step-by-step solutions for problems and error messages?,N,
"If the software can be used as a library, package or service by other software, do it provide comprehensive API documentation?",Y,
Is documentation stored under revision control with the source code?,Y,
"Does the software publish release history e.g. release data, version numbers, key features of each release etc. on their web site or in your documentation?",Y,
,,
Software User Support,,
Does this software describe how a user can get help with using your software?,Y,
"Does the website and documentation describe what support, if any, you provide to users and developers?",Y,
Does the project have an e-mail address or forum that is solely for supporting users?,Y,
Are e-mails to it's support e-mail address received by more than one person?,Y,
Does this project have a ticketing system to manage bug reports and feature requests?,Y,It uses github Issue and Pull Requests
"Is the project's ticketing system publicly visible to your users, so they can view bug reports and feature requests?",Y,
,,
Software's Maintance,,
Is the software’s architecture and design modular?,Y,
Does the software use an accepted coding standard or convention?,Y,
,,
Open standards in software,,
"Does your software allow data to be imported and exported using open data formats?* e.g. GIF, SVG, HTML, XML, tar, zip, CSV, JSON, NetCDF, or domain specific ones",Y,
"Does your software allow communications using open communications protocols?*e.g. HTTP, FTP, XMPP, SOAP over HTTP, or domain-specific ones",Y,
,,
Software's Cross-Compability,,
"Is the software cross-platform compatible?* e.g. does it run under two or more of Windows, Unix/Linux and Mac OS X, or can be used from within two or more of Internet Explorer, Chrome, Firefox and Safari?",Y,
,,
Software's accessibility,,
Does the software adhere to appropriate accessibility conventions or standards?,Y,
Does the documentation adhere to appropriate accessibility conventions or standards?,Y,
,,
Software's Realising Cycle,,
Is the source code stored in a repository under revision control?,Y,
Is each source code release a snapshot of the repository?,Y,
Are releases tagged in the repository?,Y,
"Is there a branch of the repository that is always stable? (i.e. tests always pass, code always builds successfully)",Y,
Do the sofware back-up it's repository?,Y,
,,
Software's Installation and Build,,
Do it provide publicly-available instructions for building the software from the source code?,Y,
"Can it build, or package, the software using an automated tool?* e.g. Make (https://www.gnu.org/software/make/), ANT (http://ant.apache.org/), Maven (https://maven.apache.org/), CMake (https://cmake.org/), Python setuptools (https://pypi.python.org/pypi/setuptools), or R package tools (https://cran.r-project.org/doc/manuals/r-devel/R-exts.html)",Y,
Do it provide publicly-available instructions for deploying the software?,Y,
Does the documentation list all third-party dependencies?,Y,
Does the documentation list the version number for all third-party dependencies?,Y,
"Does the software list the web address, and licences for all third-party dependencies and say whether the dependencies are mandatory or optional?",N,
"Can it download dependencies using a dependency management tool or package manager?* e.g. Ivy (http://ant.apache.org/ivy/), Maven (https://maven.apache.org/), Python pip (https://pypi.python.org/pypi/pip) or setuptools (https://pypi.python.org/pypi/setuptools), PHP Composer (https://getcomposer.org/), Ruby gems (https://rubygems.org), or R PackRat (https://rstudio.github.io/packrat/)",Y,
Do it have tests that can be run after the software has been built or deployed to show whether the build or deployment has been successful?,Y,
,,
Software's Testing,,
Does it have an automated test suite for the software?,N,"It has for backend, but not implemented for Frontend"
Does it have a framework to periodically (e.g. nightly) run the tests on the latest version of the source code?,N,
"Does it use continuous integration, automatically running tests whenever changes are made to the source code?",N,GitHub action is only present for backend.
Are the test results publicly visible?,N,
Are all manually-run tests documented?,N,
,,
Software's Community Engagement,,
"Does the project have resources (e.g. blog, Twitter, RSS feed, Facebook page, wiki, mailing list) that are regularly updated with information about your software?* e.g. release announcements, publications, workshops, conference presentations",N,
Does the website state how many projects and users are associated with the project?,N,"As it is on github, so we can see how many user has forked it, but other then it no states are provided on readme or documentation."
Does it provide success stories on the website?,N,
Does it list the important partners and collaborators on their website?,Y,
Does it list the project's publications on their website or link to a resource where these are available?,N,
Does it list third-party publications that refer to the software on the website or link to a resource where these are available?,N,
Can users subscribe to notifications to changes to the source code repository?,Y,
"If the software is developed as an open source project (and, not just a project developing open source software), does it have a governance model?",N,
,,
Software's Contribution Management,,
"Do you accept contributions (e.g. bug fixes, enhancements, documentation updates, tutorials) from people who are not part of your project?",Y,
Do you have a contributions policy?,Y,
Is your contributions' policy publicly available?,Y,
Do contributors keep the copyright/IP of their contributions?,N,
,,
Software's Licensing,,
Does the website and documentation clearly state the copyright owners of the software and documentation?,Y,
Does each of the source code files include a copyright statement?,N,
Does the website and documentation clearly state the licence of your software?,Y,Yes it is on MIT Licence and clearly stated it
Is the software released under an open source licence?,Y,
Is the software released under an OSI-approved open-source licence?,Y,
Does each of the source code files include a licence header?,Y,
Do it have a recommended citation for your software?,Y,Yes Citation.cff file is present
,,
Software's Future Plan,,
"Does the website or documentation include a project roadmap (a list of project and development milestones for the next 3, 6 and 12 months)",Y,"Yes, it is present in the documentation. https://github.com/NCSU-Group7-SE2021/slash/tree/main#golf-future-roadmap"
"Does the website or documentation describe how the project is funded, and the period over which funding is guaranteed?",N/A,
"Do you make timely announcements of the deprecation of components, APIs, etc.?",N,
,,
,,
Workload is spread over the whole team,3,Can see commit's from different people on github Insights
Number of commits,3,"It has 64 commits, which is decent amount of commit on project done for small duration"
Number of commits: by different people,1,Not Evenly Spreaded
Issues reports,2,There are 36 Issues reported
Issues are being closed,2,32 out of 36 have been closed
DOI badge: exists,3,"There are certain badges exist like licence, buildpassing, issues closed, etc"
"Docs: doco generated, format not ugly",0,No Doc's Auto generation is implemented
Docs: what: point descriptions of each class/function (in isolation),0,
"Docs: how: for common use cases X,Y,Z mini-tutorials showing worked examples on how to do X,Y,Z",3,
"Docs: why: docs tell a story, motivate the whole thing, deliver a punchline that makes you want to rush out and use the thing",2,"Sceeming though readme provides some basic level info of what does the software do and why should I use it, but it could be better"
Use of version control tools,3,
Use of style checkers,0,
Use of code formatters.,0,
Use of syntax checkers.,0,
Use of code coverage,3,
Other automated analysis tools,0,
Test cases exist,3,Test cases for all funcionality do exist
Test cases are routinely executed,2,Works on every push
The files CONTRIBUTING.md lists coding standards and lots of tips on how to extend the system without screwing things up,3,
Issues are discussed before they are closed,1,Most issue are not discussed.
Chat channel: exists,0,
Test cases: a large proportion of the issues related to handling failing cases.,2,Some Issues are related to enhancement type
"Evidence that the whole team is using the same tools (e.g. config files in the repo, updated by lots of different people)",3,
Evidence that the members of the team are working across multiple places in the code base,3,Can been seen through commit history